<?xml version="1.0" encoding="UTF-8" standalone="yes"?>
<sdk xmlns:xsi="http://www.w3.org/2001/XMLSchema-instance"
     xsi:schemaLocation="https://github.com/macomfan/cei https://macomfan.github.io/cei/schema/ceisdk-0.0.1.xsd"
     xmlns="https://github.com/macomfan/cei"
     name="huobipro">
    <models>
        <model name="Trade">
            <int name="id"/>
            <int name="tradeID"/>
            <decimal name="price"/>
            <decimal name="amount"/>
            <string name="direction"/>
            <int name="ts"/>
        </model>
    </models>

</sdk>