<?xml version="1.0" encoding="UTF-8"?>
<sdk xmlns:xsi="http://www.w3.org/2001/XMLSchema-instance"
     xsi:schemaLocation="https://github.com/macomfan/cei https://macomfan.github.io/cei/schema/ceisdk-0.0.1.xsd"
     xmlns="https://github.com/macomfan/cei"
     name="binance">
    <models>
        <model name="AggregateTrade">
            <int name="id"/>
            <decimal name="price"/>
            <decimal name="qty"/>
            <int name="timestamp"/>
            <int name="firstTradeId"/>
            <int name="lastTradeId"/>
            <boolean name="isBuyerMaker"/>
            <boolean name="isBestMatch"/>
        </model>
    </models>
</sdk>