<?xml version="1.0" encoding="UTF-8" standalone="yes"?>
<sdk xmlns:xsi="http://www.w3.org/2001/XMLSchema-instance"
     xsi:schemaLocation="https://github.com/macomfan/cei https://macomfan.github.io/cei/schema/ceisdk-0.0.1.xsd"
     xmlns="https://github.com/macomfan/cei"
     name="huobipro">
    <models>
    <model name="LastTrade">
        <string name="status"/>
        <string name="ch"/>
        <int name="ts"/>
        <int name="tsInTick"/>
        <int name="idInTick"/>
        <object_array name="data" model="Trade"/>
    </model>
    </models>
</sdk>