<?xml version="1.0" encoding="UTF-8"?>
<sdk xmlns:xsi="http://www.w3.org/2001/XMLSchema-instance"
	 xsi:schemaLocation="https://github.com/macomfan/cei https://macomfan.github.io/cei/schema/ceisdk-0.0.1.xsd"
	 xmlns="https://github.com/macomfan/cei"
	 name="binance">
	<clients>
		<restful name="MarketClient">
			<interfaces>
				<interface name="getTrade">
					<inputs>
						<string name="symbol"/>
						<int name="limit"/>
					</inputs>
					<request method="get" target="/api/v3/trades">
						<query_strings>
							<query key="symbol" value="{symbol}"/>
							<query key="limit" value="{limit}"/>
						</query_strings>
					</request>
					<response>
						<json_parser model="TradeList">
							<json_object_for_each value="{data}" model="Trade">
								<json_value copy="id"/>
								<json_value copy="price"/>
								<json_value copy="qty"/>
								<json_value copy="quoteQty"/>
								<json_value copy="time"/>
								<json_value copy="isBuyerMaker"/>
								<json_value copy="isBestMatch"/>
							</json_object_for_each>
						</json_parser>
					</response>
				</interface>
			</interfaces>
		</restful>
	</clients>

</sdk>